topic,date,author,headline,link,subline,article,summary
technology,2023-06-07,Gregory Han,Smeg FAB28 Fridge's New Colors Are as Inviting as a Summer in Italy,https://design-milk.com/smeg-fab28-fridges-new-colors-are-as-inviting-as-a-summer-in-italy/,The 4 new colors of the Smeg FAB28 fridge are inspired by the landscape in and around Italy as the bold embodiment of la dolce vita!,"A summer exploring Italy will always be remembered as a journey of color: the palette of pale and rust Mediterranean hues brushed across the countryside, the mineral-laden volcanic soil of Vesuvius, the vivid azure blue sea. Those are just a few of the evocations of tinted memories that inspired luxury Italian appliance brand Smeg to release a new series of colors, enhancing their already iconic FAB28 refrigerator silhouette with a bold refresh that aligns with the growing trend of inviting colors into the kitchen.Eight colors were initially previewed in Milan in 2022 as candidates to be voted upon before choosing the final “colors of Smeg’s summer 2023.” Voters deemed Azzurro Blue, Perfectly Pale, and Rust as favorites; a Matte Black option was added to round off this quartet of soft touch matte surface refrigerators.As someone who has been mulling over a new refrigerator for our mother-in-law’s kitchenette, the FAB28 proposes a more enriching element to the kitchen than the austere and cold options typical of appliances.Inside, the FAB28 Refrigerator remains the same, housing three adjustable glass shelves, one fixed glass shelf, a bottle rack, fruit and vegetable container, and dairy box. Despite its slim size, there are also two adjustable covered bins, two bottle storage bins, four adjustable bins, and two egg bins across the door, with LED lights illuminating the interior, an adjustable thermostat, and MultiFlow air distribution to keep produce fresh as long as possible.Except for the blue option, the earthen collection presents a more contemporary, rather than retro, feel.While three of these new colors are inspired by hues of the Italian landscape in summer, the matte black addition is marked as the final component of Smeg’s modern matte black range of kitchen appliances and accessories, which includes a kettle, toaster, and new Classic oven finish for an entirely modernist noir aesthetic.The entire range of new colors for the FAB28 are available for £1,899 via shop.smeguk.com and Smeg’s Regent Street flagship store. No word on if these new colors will make it to the US or not.Gregory Han is the Managing Editor of Design Milk. A Los Angeles native with a profound love and curiosity for design, hiking, tide pools, and road trips, a selection of his adventures and musings can be found at gregoryhan.com.You can follow Gregory Han on Twitter, Pinterest, and Instagram. Read all of Gregory Han's posts.Gustave Carlson Design respectfully renovated a prized Eichler house in Palo Alto that honored the history while adapting it for modern times.Japanese technology brand BALMUDA dedicated 6 years of design and development to get drip coffee preparation dialed in.As small as a MINI, as capacious as a Tacoma, and designed by Yves Béhar, the TELO mini electric truck is proof big things can come in small packages.Leica's third in the Q series keeps all the great design cues of the Q2 with the addition of a 3-inch high resolution touchscreen.You’ll always hear it from Design Milk first. Our passion is discovering and highlighting emerging talent, and we’re energized by and for our community of like-minded design lovers — like you!","the FAB28 refrigerator silhouette with a bold refresh that aligns with the growing trend of inviting colors into the kitchen. eight colors were initially previewed in Milan in 2022 as candidates to be voted upon before choosing the final “colors of Smeg’s summer 2023”. the entire range of new colors are available for £1,899 via shop.smeguk.com and Smeg’s Regent Street flagship store."
technology,2023-06-05,Gregory Han,Teenage Engineering TP–7 Offers the Reel Sensation of Tactile Controls,https://design-milk.com/teenage-engineering-tp-7-offers-the-reel-sensation-of-tactile-controls/,"Teenage Engineering's master class audio device TP-7 is designed for true, one-hand operation, emphasizing the senses of touch, sound, and sight.","The touchscreen display is one of the greatest – and polarizing – inventions in modern times. While a display interface on a mobile device can transform into an endless array of configurations and purposes, that adaptability in utility comes at a price: losing the sheer simplicity of operating by tactile feedback. It is almost always easier to press a button or turn a dial than navigating a graphical interface – “tap to open, scroll, and press.”This is particularly true when capturing audio, a task I often rely upon while interviewing subjects using my iPhone. I make it a habit to have the app ready ahead of recording to prevent the dreaded instance of “GAH! I wasn’t recording” every journalist runs into at one time or another. Even when operating correctly I’m perpetually checking to make sure it’s recording because of the lack of physical (and aural) indications my device is correctly recording.The Teenage Engineering TP–7 field recorder is an interesting proposition, not so much a compromise, but a digital recording device designed to invite the fingers to intuitively utilize physical controls just like an analog tape recorder of yore: the index finger triggers fast forward, the middle finger rewinds, the thumb records a memo, and the pinky selects the mode.Just as early computing and mobile device design veered toward skeuomorphism – the approach in making digital tools resemble their real-world counterparts – so can be said of the TP–7’s form, one mimicking the appearance and movement of a motorized tape reel to clearly communicate the device is in fact recording.Inside the TP-7 is a brushed motor with ball bearings, and a highly sensitive hall sensor that lets you virtually grab your recording. The reel is a cool gimmick, but one that is engineered to be used in conjunction with a novel side-mounted rocker that gives the user the option to scrub, fast forward, and rewind by touch. The entire physical interface would take mere minutes, perhaps seconds, for a new user to figure out. It also comes with the perk of a scrubbing action propelling the wheel accompanied with a ’hyperspeed’ sound for amusing effect.Kudos to Teenage Engineering for also launching the TP–7 with an accompanying app to automatically transcribe any audio interviews to text.TP–7 features three stereo two-way jacks to be used as either inputs or outputs, for connecting external mics, headphones, studio monitors, or any other audio equipment like OP–1 field or TX–6, recording with all 6 stereo channels. The recorder is compatible with USB-C for multi-channel audio interface, MIDI, data transfer, and charging, with Bluetooth Low Energy and MFi capability for wireless connectivity. TP–7 also includes our 6.35 mm to 3.5 mm jack adapter, and up to 128 GB of internal storage (which equates to 5 minutes of ideas a day for 20 years).The Teenage Engineering TP–7 field recorder is not designed for everyone, especially at its eye-bulging price (the very reason I haven’t rushed out to buy one myself). It is by design a purposely particular device for particular people. But for anyone who regularly relies upon recording audio for professional purposes, we wouldn’t blame you for caving into the temptation to splurge hard upon a device engineered to record interviews, capture sound or music, or to use in similar fashion as Twin Peak’s Agent Cooper in such stylish and touching fashion.Gregory Han is the Managing Editor of Design Milk. A Los Angeles native with a profound love and curiosity for design, hiking, tide pools, and road trips, a selection of his adventures and musings can be found at gregoryhan.com.You can follow Gregory Han on Twitter, Pinterest, and Instagram. Read all of Gregory Han's posts.Gustave Carlson Design respectfully renovated a prized Eichler house in Palo Alto that honored the history while adapting it for modern times.Japanese technology brand BALMUDA dedicated 6 years of design and development to get drip coffee preparation dialed in.As small as a MINI, as capacious as a Tacoma, and designed by Yves Béhar, the TELO mini electric truck is proof big things can come in small packages.Leica's third in the Q series keeps all the great design cues of the Q2 with the addition of a 3-inch high resolution touchscreen.You’ll always hear it from Design Milk first. Our passion is discovering and highlighting emerging talent, and we’re energized by and for our community of like-minded design lovers — like you!",– and polarizing – inventions in modern times. a touchscreen display interface on a mobile device can transform into an endless array of configurations and purposes. but that adaptability comes at a price: losing the sheer simplicity of operating by tactile feedback.
technology,2023-06-02,Gregory Han,The Hervet Manufacturier Bellame Speaker Captures a Daft 70s Vibe,https://design-milk.com/the-hervet-manufacturier-bellame-speaker-captures-a-daft-70s-vibe/,"Just 100 of these retro-futuristic audio systems are being handmade to bridge ""the gap between fine woodworking and high-fidelity sound.""","There was a time when you couldn’t walk into any space – club, restaurant, bar, shop, party – without the ubiquity of the Daft Punk musical catalog ever present. The musical duo’s imprint wasn’t just melodic, but an entire retro-futuristic aesthetic… a whole damn vibe, if you may. Cousins Cédric and Nicolas Hervet have continued to build upon that vibe, founding spatio-temporal hi-fi boutique brand Hervet Manufacturier with the elder of the two, Cedric, helping keep the Daft Punk party going as the duo’s Artistic Director.Hervet Manufacturier’s latest Bellame Speaker system plays tribute to that musical duo and the vintage recording studios from the 70s and 80s they inhabit in the form of a handcrafted, limited edition audio system bridging “the gap between fine woodworking and high-fidelity sound.”The Bellame speakers shares the design DNA of pedestal floor speaker designs that once proliferated home and studios throughout the 1970s and early 1980s, most notably the Eero Saarinen designed Bose 901s. These current day speakers are built around a sizable enclosure with left/right satellites tasked for mid-high frequencies and a dual bass all enclosed within a solid Santos rosewood cabinetry, each stationed upon brushed stainless steel stands and reinforcement parts with full-grain leather-covered baffles.The dual bass enclosure features 10-inch paper cone drivers mounted on the front to really bring forth the oomph of bass.Within this enclosure, all the necessary electronics are integrated to power the dual bass enclosure and the left/right satellites responsible for mid-high frequencies, featuring 8 line inputs and an MM phono input for turntable integration. There’s also a 24-bit/192 kHz DAC with 5 inputs, including USB-A and USB-B. Note, you will need to invest in an optional dongle for Bluetooth connectivity, which seems one glaring omission from an otherwise comprehensive system for plug and play use (but perhaps wholly in spirit with the 70s-80s reference).A simplified control panel includes a volume adjustment and a remote control receiver for easy control from the listening area.The sum of components within the Bellame delivers a power output rated for 2×75 W (satellites) and 220 W for the bass emanating center receiver console unit, plenty to fill a large living room, and then some.If you ever see one of these Bellame Speakers in the wild around the world, consider yourself fortunate. There will only be 100 of these made by Hervet Manufacturier for a princely sum of $20,990, a handcrafted audio experience warranting the request, “one more time.”Gregory Han is the Managing Editor of Design Milk. A Los Angeles native with a profound love and curiosity for design, hiking, tide pools, and road trips, a selection of his adventures and musings can be found at gregoryhan.com.You can follow Gregory Han on Twitter, Pinterest, and Instagram. Read all of Gregory Han's posts.Gustave Carlson Design respectfully renovated a prized Eichler house in Palo Alto that honored the history while adapting it for modern times.Japanese technology brand BALMUDA dedicated 6 years of design and development to get drip coffee preparation dialed in.As small as a MINI, as capacious as a Tacoma, and designed by Yves Béhar, the TELO mini electric truck is proof big things can come in small packages.Leica's third in the Q series keeps all the great design cues of the Q2 with the addition of a 3-inch high resolution touchscreen.You’ll always hear it from Design Milk first. Our passion is discovering and highlighting emerging talent, and we’re energized by and for our community of like-minded design lovers — like you!",and a dual bass enclosure.The dual bass enclosure features 10-inch paper cone drivers mounted on the front to really bring forth the oomph of bass. The bellame speakers share the design DNA of pedestal floor speaker designs that once proliferated home and studios throughout the 1970s and early 1980s.
technology,2023-06-01,Gregory Han,Leica Q3: The Travel and Street Photography Camera Perfected?,https://design-milk.com/leica-q3-the-travel-and-street-photography-camera-perfected/,Leica's third in the Q series keeps all the great design cues of the Q2 with the addition of a 3-inch high resolution touchscreen.,"Money cannot buy happiness… but it can help you buy a Leica. The German camera manufacturer’s legions of devotees have long elevated the red circle badged cameras from mere imaging tools into aspirational photographic heirlooms. Credit the brand’s timeless appeal to a reputation built upon carefully machined minimalist bodies, distinct optics, veneration associated with some of the most famous photos and photographers, and no doubt the exclusivity of owning a standout design that evokes envy. The newest full frame Leica Q3 camera will likely further burnish this storied rep, adding upon its 2019 predecessor with both subtle and major upgrades, in sum offering what may be considered the ultimate street photography camera.Taking a similar approach to Apple’s incremental improvements with the iPhone, Leica has retained many of the best attributes of the 2019 Q2, an approach that seems to make sense considering the Q2 has remained extremely popular to this day. This third iteration shares the same 28mm f/1.7 Summilux ASPH lens, a fantastic walk-around optics now further enhanced by the newly upgraded 60 mega-pixel BSI CMOS sensor with Triple Resolution Technology, allowing for 60, 36, or 18 MP resolution. As an amateur nature photographer, I’m thrilled to see the Q3 equipped with an integrated macro mode, allowing the ability to get as close as 17 cm to subjects.There’s also the inclusion of the same digital zoom of previous Q models, offering cropping to focal lengths of 28, 35, 50, 75, and 90 mm; those who like to shoot specifically for online content will also benefit from two new and practical assistants: Leica Perspective Control and Leica Dynamic Range (designed to ensure perfect JPEG images without any post processing).Content creators take note: the new Q3 can record video at 8k resolution and in H.265 and Apple’s ProRes codecs; USB-C and HDMI accessories are also supported.Though we’ve yet to get our own hands on a production model, the 3rd in the Q series seems to share all of the same desirable design cues that have made the Q2 an influencer darling. It looks as beautifully crafted, retaining the handsome contrast between cross-hatched front to machined metal body. What has changed is the addition of new tiltable, water- and dust-resistant IP52 certified 3-inch high resolution touchscreen with 5.76 million resolution, addressing a glaring omission from its predecessor.And as another sign of the continuing convergence between digital photography and mobile photography, the Leica Q3 now supports wireless charging via an optional Leica Drop XL Wireless Charger and separate camera handgrip. Designed by Native Union, the combo makes the case the digital camera category still has a few more features (beyond vastly superior optics and usable resolution) to keep cameras relevant amongst photographers beyond devotees of pricey German industrial design.This post contains affiliate links, so if you make a purchase from an affiliate link, we earn a commission. Thanks for supporting Design Milk!Gregory Han is the Managing Editor of Design Milk. A Los Angeles native with a profound love and curiosity for design, hiking, tide pools, and road trips, a selection of his adventures and musings can be found at gregoryhan.com.You can follow Gregory Han on Twitter, Pinterest, and Instagram. Read all of Gregory Han's posts.Gustave Carlson Design respectfully renovated a prized Eichler house in Palo Alto that honored the history while adapting it for modern times.Japanese technology brand BALMUDA dedicated 6 years of design and development to get drip coffee preparation dialed in.As small as a MINI, as capacious as a Tacoma, and designed by Yves Béhar, the TELO mini electric truck is proof big things can come in small packages.Leica's third in the Q series keeps all the great design cues of the Q2 with the addition of a 3-inch high resolution touchscreen.You’ll always hear it from Design Milk first. Our passion is discovering and highlighting emerging talent, and we’re energized by and for our community of like-minded design lovers — like you!","the Q3 is a storied rep, with a new full frame Q3 camera. The new Q3 can record video at 8k resolution and in H.265 and ProRes codecs. the new Q3 can record video at 8k resolution and in H.265."
art,2023-06-01,Kelly Beall,Desktop Wallpaper: June 2023,https://design-milk.com/desktop-wallpaper-june-2023/,"Illustrator Daniel Ramirez Perez shares a geometric, pattern-filled landscape for our June Designer Desktop! Download it now!","It’s unofficially time for summer to begin, and we’re celebrating with a bold, geometric Designer Desktop by Daniel Ramirez Perez! A true creative, Daniel works in illustration, design, and motion, launching his own illustration studio in 2014. A background in fashion – he interned at Vivienne Westwood! – helped to quickly advance Daniel’s style and put his career on the fast track. Since then, he’s worked with clients throughout advertising, editorial, music, and culture, such as Lufthansa, Thom Yorke, The Wall Street Journal, Ballhaus Ost, and TBWA/Chiat/Day.Artwork for Thom YorkeLove Is Love ProjectFruitsJoy Breeze Mall InstallationsDaniel Ramirez PerezDownload yours with the links below!DESKTOP: 1024×768 \\\ 1280×1024 \\\ 1680×1050 \\\ 1900×1200 \\\ 2560×1440MOBILE: iPhone XS \\\ iPhone XS Max \\\ iPad ProLearn more about Daniel Ramirez Perez here and follow on IG here.View and download past Designer Desktops here.Kelly Beall is senior editor at Design Milk. The Pittsburgh-based graphic designer and writer has had a deep love of art and design for as long as she can remember, and enjoys sharing her finds with others. When undistracted by great art and design, she can be found making a mess in the kitchen, consuming as much information as possible, or on the couch with her three pets. Find her @designcrush on social.You can follow Kelly Beall on Twitter, Facebook, Pinterest, and Instagram. Read all of Kelly Beall's posts.Illustrator Daniel Ramirez Perez shares a geometric, pattern-filled landscape for our June Designer Desktop! Download it now!This month's Designer Desktop artist is London-based textile designer Amelia Graham who's known for her geometric and arithmetic patterns and works.Beijing-based artist Jen Du, known for her modern geometric abstractionism, inspires us to think differently with this month's free download.This month's downloadable Designer Desktop features a trippy and eye-catching digital abstraction by graphic designer Mario De Meyer. Download it now!You’ll always hear it from Design Milk first. Our passion is discovering and highlighting emerging talent, and we’re energized by and for our community of like-minded design lovers — like you!",": iPhone XS  iPhone XS Max  iPad ProLearn more about Daniel Ramirez Perez on social.You can follow Kelly Beall on Twitter, Facebook, Pinterest, and Instagram."
technology,2023-05-29,Gregory Han,LAYER Takes a Quiet Approach to Technology for Samsung,https://design-milk.com/layer-x-samsung-quiet-technology/,Soften the din of technology in your life with this organic and quietly conceived battery pack design by LAYER and founder Benjamin Hubert for Samsung.,"Even if you’re oblivious of the hype building around the pending finale of HBO’s Succession, you’ve probably gotten whiff of the fashionable catchphrase “quiet luxury” floating around these days, a term encapsulating the neutral, label-free, and supremely tailored fashion preferred by the Roy family as an extension of their stealth wealth. If the Roys were to ever concern themselves about their mobile devices as they are about keeping their Loro Piana caps always ready, they’d possibly be carrying around the subtly done LAYER x Samsung Battery Pack.Each Samsung Battery Pack features a 25W 10,000 mAh capacity allowing for Super Fast Charging for multiple devices simultaneously.The minimalist slab’s pebble-like finish is made with a soft speckled plastic delivering a quiet tactile pleasure, a design LAYER and studio founder Benjamin Hubert describes as indicative of a “clean, elegant design” evoking “soft stone-like forms” and a “palette aligned with interior design.”The Samsung Battery Pack’s gently rounded form and flat end are conceived to clearly display access to its dual USB-C ports with just a glance. The only pronounced embellishment LAYER has given the device beyond its tactile feel is a graphic typographic “10” debossed across the charger’s neutrally hued surface, a large numeral denoted its 10,000 mAh charging capacity.We are proud to have partnered with Samsung since the very beginnings of LAYER. The new Battery Pack is a small part of a larger collaboration, and it is exciting to release the first of many products we are working on. The Samsung Battery Pack is accessible, functional, and simple yet instantly identifiable and memorable, bringing a little bit of joy to the everyday-Benjamin Hubert – Founder, LAYERThe Samsung Battery Pack is part of an ongoing collaboration between LAYER and Samsung, and is available for $35.This post contains affiliate links, so if you make a purchase from an affiliate link, we earn a commission. Thanks for supporting Design Milk!Gregory Han is the Managing Editor of Design Milk. A Los Angeles native with a profound love and curiosity for design, hiking, tide pools, and road trips, a selection of his adventures and musings can be found at gregoryhan.com.You can follow Gregory Han on Twitter, Pinterest, and Instagram. Read all of Gregory Han's posts.Gustave Carlson Design respectfully renovated a prized Eichler house in Palo Alto that honored the history while adapting it for modern times.Japanese technology brand BALMUDA dedicated 6 years of design and development to get drip coffee preparation dialed in.As small as a MINI, as capacious as a Tacoma, and designed by Yves Béhar, the TELO mini electric truck is proof big things can come in small packages.Leica's third in the Q series keeps all the great design cues of the Q2 with the addition of a 3-inch high resolution touchscreen.You’ll always hear it from Design Milk first. Our passion is discovering and highlighting emerging talent, and we’re energized by and for our community of like-minded design lovers — like you!","LAYER x Samsung Battery Pack is accessible, functional, and simple yet instantly identifiable and memorable. The Samsung Battery Pack is accessible, functional, and simple yet instantly identifiable and memorable, bringing a little bit of joy to the everyday-Benjamin Hubert – Founder, LAYER."
