topic,date,author,headline,link,subline,article,summary
technology,2023-06-21,Gregory Han,Geistmaschine ASP Series Keyboards Are Ambitiously Elegant,https://design-milk.com/geistmaschine-asp-series-keyboards-are-ambitiously-elegant/,"These four elegantly finished keyboards imagined for designers, architects, and aesthetes hide a magnetic modular customization design.","Berlin-based Geistmachine harbors a notably higher aspiration and attention to detail within a realm already notorious for meticulous specs and unique customizations imagined to elevate the humble keyboard into a personalized expression. The Geistmachine ASP series may be the most beautiful – or at least, the most elegant – keyboard line available today, outfitted with maniacally precise fit and finish, a magnetic modular customization system, and even packaging befitting of a luxury good.Geistmachine’s monolithic minimalist slab design centers around a modular ferritic stainless steel band construction that wraps around the entire keyboard. The bands are there to both organize/divide sections of keys and numerical input, while also permitting users to magnetically attach a myriad of accessories.The keyboard’s flat cuboid profile can be lifted with a 6.5-degrees stand to improve ergonomics or it can be removed for typing across a flat configuration. With the stand in place a Flat-Weight can be attached magnetically to the stainless bands and align itself with the U-Stand to improve acoustics and increase the perceived weight/heft with every keystroke.Another detail worth noting – especially for southpaw typists – is the position of the numerical keys. Situated to the left side of the keyboard, this permits more accessible numerical input while also easing access to the right for mouse movements. There’s also the option to add an audio knob, a detail that pairs particularly nicely with the sum of its mechanical-machined aesthetic.Embellished with touches of polished steel, copper, or rose gold Geistmachine positions their pricey peripherals specifically for spaces where an aesthete’s eye for detail requires something special, including design and architecture studios, ateliers, and other hospitality environments.Geistmachine is launching with four different editions, each embellished with distinct choices in materials and surface finishes, with options to further customize.The Engineering Edition leaves materials in their natural color without color-altering surface treatments and often comes with a transparent top housing to reveal the internals underneath and a signature copper bottom case. Starting from $799.The Initial Edition picks unique characteristics of the other editions and recomposes its own edition. The IE often gets introduced first to showcase features of a new project line. Starting from $649.The Graphic Edition resembles contemporary graphic design and timeless elegance of Swiss/German typography. The matte surfaces emphasize the clean lines and monolithic geometries of the design. Starting from $499.The Selected Edition chooses premium materials and surface finishes to create a sophisticated, graceful edition that resembles luxurious jewelry. Starting from $669.All four keyboards are currently on pre-sale at geistmaschine.io through July 6th.Gregory Han is the Managing Editor of Design Milk. A Los Angeles native with a profound love and curiosity for design, hiking, tide pools, and road trips, a selection of his adventures and musings can be found at gregoryhan.com.You can follow Gregory Han on Twitter, Pinterest, and Instagram. Read all of Gregory Han's posts.Gustave Carlson Design respectfully renovated a prized Eichler house in Palo Alto that honored the history while adapting it for modern times.Japanese technology brand BALMUDA dedicated 6 years of design and development to get drip coffee preparation dialed in.As small as a MINI, as capacious as a Tacoma, and designed by Yves Béhar, the TELO mini electric truck is proof big things can come in small packages.Leica's third in the Q series keeps all the great design cues of the Q2 with the addition of a 3-inch high resolution touchscreen.You’ll always hear it from Design Milk first. Our passion is discovering and highlighting emerging talent, and we’re energized by and for our community of like-minded design lovers — like you!",", the Geistmachine ASP series, is launching with four different editions. Each is embellished with distinct choices in materials and surface finishes. The initial Edition picks unique characteristics of the other editions and recomposes its own edition."
technology,2023-06-20,Gregory Han,Bang & Olufsen Newest Atelier Editions Are Made to Make Others Green With Envy,https://design-milk.com/bang-olufsen-beoplay-ex-beosound-2-atelier-editions-green/,The Danish audio brand Bang & Olufsen's latest Atelier Editions are set to make everyone green with envy with two shades inspired by nature in summer.,"Premier Danish audio brand Bang & Olufsen’s line of devices already carry with them an inherent air of exclusivity by virtue of their design, price, and limited availability. But B&O’s newest offerings representing their ongoing Atelier Editions series takes things to another level. If you’re able to cop one of the 64 Beoplay EX earphones in Forest Green or one of the 15 monolithic cone-shaped Beosound 2 wireless speakers in Gradient Green, consider yourself very fortunate.Inspired by the “abundance of nature in the summer months,” the Gradient Green Atelier Editions version of the 360-degrees sound wireless speaker presents a much more conspicuous presence compared to the normal aluminum, gold tone, or black anthracite options, alongside an even more conspicuous $5,699 price tag. As its name implies, the green sheen of the tinted aluminum speaker deepens across the length, from a lime hued top down to its meadow grass green base.The Forest Green color drop of the Atelier Editions Beoplay EX earphones is a little less striking than its wireless speaker counterpart, but also a tad bit more attainable at just $699. Still, if you’re partial to this hue, note the Danish audio brand is only releasing 64 units.Previous Atelier Editions include Beoplay EX earphones in Peach Pink and Pineapple Yellow colorways.Previous Atelier Editions included a similar Lime Green, Peach Pink, and Pineapple Yellow. These two new green hued editions are available to order till they’re all sold out, surely making those who miss the opportunity green with envy.This post contains affiliate links, so if you make a purchase from an affiliate link, we earn a commission. Thanks for supporting Design Milk!Gregory Han is the Managing Editor of Design Milk. A Los Angeles native with a profound love and curiosity for design, hiking, tide pools, and road trips, a selection of his adventures and musings can be found at gregoryhan.com.You can follow Gregory Han on Twitter, Pinterest, and Instagram. Read all of Gregory Han's posts.Gustave Carlson Design respectfully renovated a prized Eichler house in Palo Alto that honored the history while adapting it for modern times.Japanese technology brand BALMUDA dedicated 6 years of design and development to get drip coffee preparation dialed in.As small as a MINI, as capacious as a Tacoma, and designed by Yves Béhar, the TELO mini electric truck is proof big things can come in small packages.Leica's third in the Q series keeps all the great design cues of the Q2 with the addition of a 3-inch high resolution touchscreen.You’ll always hear it from Design Milk first. Our passion is discovering and highlighting emerging talent, and we’re energized by and for our community of like-minded design lovers — like you!","a little less striking than its wireless speaker counterpart, but also a tad bit more attainable at just $699. Atelier Editions include Beoplay EX earphones in Peach Pink and Pineapple Yellow colorways.Previous Atelier Editions included a similar Lime Green, Peach Pink, and Pineapple Yellow colorways."
technology,2023-06-19,Gregory Han,TELO is a Tiny Electric Truck With Big Load Capacity and 350-Miles Range,https://design-milk.com/telo-electric-truck/,"As small as a MINI, as capacious as a Tacoma, and designed by Yves Béhar, the TELO mini electric truck is proof big things can come in small packages.","Trucks are hugely popular across the United States, with pickups (and SUVs) ranked as the most popular segment of vehicles over the past four years. Unsurprisingly, electric trucks like the Rivian R1T and Ford Lightning are also doing well, with growing demand for vehicles with load capacity, EV efficiency and performance, technological amenities, and the option to get off the beaten path to seek adventure tempting car buyers into PHEV trucks in droves. But trucks today are increasingly oversized for everyday tasks, especially for those living in urban zip codes where parking a mid or full-size truck can prove challenging. TELO, a new electric truck arrives as the antithesis of the modern pickup, a small but capable EV pickup designed for urbanites who want all of the perks of a truck with a fraction of the parking space footprint.In Japan, small alleyway width Kei trucks are designed to navigate the tightest spaces, aiding city dwellers and farmers alike with a myriad of tasks. But in the United States, even the smallest truck – currently the Hyundai Santa Cruz – still measures close to 200 inches in length and 75 inches in width. Compare those numbers to the 152-inch long TELO, an electric truck comparable in size to a MINI Cooper. Yet this wee work and play vehicle also is outfitted with the same as most Toyota Tacoma trucks (a 5-foot bed; though still smaller than this truck owner’s daily driver, a Tacoma with the 6-foot bed option), and a four-door five-passenger spacious interior.With a pugnacious front somewhat reminiscent of the Canoo pickup truck, but smaller, the TELO’s modest proportions offer something beyond a parking space-friendly demeanor. This little EV can keep on trucking for 350 miles between charges.The TELO’s 106kWh battery pack charges to capacity in just 20-minutes (20-80%), powering a 380 kW dual motor AWD for a total of 500 HP and good for 0-60 in 4 seconds, while delivering 350 miles of range (just enough to get you from Los Angels to San Francisco in one go).The truck’s unique design is the work of fuseproject and Yves Béhar (far right), TELO’s Head of Design and Advisor, here with TELO’s co-founder, CEO Jason Marks and co-founder, CTO Forrest North.“For us, the opportunity to design with the latest EV technology meant that we could create a category defining and environmentally mighty ultra-compact pickup truck,” says TELO’s Head of Design, Yves Béhar. “It is designed for city adventurers who want a vehicle nimble enough for city streets and robust enough for outdoor exploring, with plenty of space for their people and gear. It has been an honor to bring to life an unparalleled EV truck which offers best-in-class utility, safety and all around drivability.”The TELO’s bed capacity is expandable thanks to a specially designed mid-partition between the back-seat and the truck bed. Folded down, longer items can intrude from the truck bed into the interior of the truck, enabling transport of items as large as 4-feet by 8-feet sheets of plywood, long ladders, or as shown here, an armada of 9-foot surfboards.TELO is being aimed at “urban adventurers” seeking the practicality of a small footprint vehicle for the daily tasks with the load capacity and power of a traditional truck, and noting our own positive response to this design, TELO has a good possibility of establishing an entirely new segment sorely lacking in the United States market: the mini electric truck.TELO will retail for $49,999 (not including State and Federal Electric Vehicle Tax Credits) and is currently available for pre-order with a deposit of $152 at www.telotrucks.com.Gregory Han is the Managing Editor of Design Milk. A Los Angeles native with a profound love and curiosity for design, hiking, tide pools, and road trips, a selection of his adventures and musings can be found at gregoryhan.com.You can follow Gregory Han on Twitter, Pinterest, and Instagram. Read all of Gregory Han's posts.Gustave Carlson Design respectfully renovated a prized Eichler house in Palo Alto that honored the history while adapting it for modern times.Japanese technology brand BALMUDA dedicated 6 years of design and development to get drip coffee preparation dialed in.As small as a MINI, as capacious as a Tacoma, and designed by Yves Béhar, the TELO mini electric truck is proof big things can come in small packages.Leica's third in the Q series keeps all the great design cues of the Q2 with the addition of a 3-inch high resolution touchscreen.You’ll always hear it from Design Milk first. Our passion is discovering and highlighting emerging talent, and we’re energized by and for our community of like-minded design lovers — like you!",", TELO, a new electric truck arrives as the antithesis of the modern pickup. TELO, a new electric truck arrives as the antithesis of the modern pickup, a small but capable EV pickup designed for urbanites. but trucks today are increasingly oversized for everyday tasks, especially for those living in urban zip codes."
technology,2023-06-16,Gregory Han,Rivian Wants to Redesign EV Shopping Into an Inviting Space,https://design-milk.com/rivian-wants-to-redesign-ev-shopping-into-an-inviting-space/,Rivian wants to make buying one of their EV trucks or SUVs a casual and pressure-free experience with the launch of Rivian Spaces.,"“Disruptive” is thrown reflexively and regularly when discussing electric vehicles’ impact upon automotive manufacturing, fuel efficiency, mobility technologies, and ultimately how we drive. But alongside these developing changes, the public’s expectations related to the car shopping experience is also evolving, one veering away from the haggle and hassle of dealership-oriented car buying of yesteryear. The introduction of EV truck and SUV maker Rivian’s Spaces in New York City’s Meatpacking District is the first of several brick-and-mortar retail showrooms meant to connect with new EV buyers who want to casually get to know the brand, vehicles, and electric vehicle technologies all without the dreaded hard sell.“Rivian Spaces are purposefully designed to be casual and inviting, where anyone who is curious is welcome to come in to learn more about us and our products,” said Denise Cherry, Senior Director of Facilities Design and Retail Development at Rivian. “We’ve peeled away the formality that can be associated with automotive retail and focused on creating a relaxed, family-friendly environment that invites guests to stay awhile and discover at their own pace.” That’s all a nice way of saying Rivian’s Spaces are imagined to be more like other retail experiences and less of the unwelcome persuasive spiel attached to today’s auto dealerships.A render for comparison. Located under the High Line in New York City, the product displays inside the New York City Spaces are made from diverted ocean-bound plastics from Rivian’s factory in Normal, Illinois while greenery throughout takes cues from the High Line which is just above the retail space.Cherry emphasizes the difference between these Spaces and a traditional dealership is their “casual, warm atmosphere”, an environment expressed through their choices in materials, eclectic furnishings and interactive educational displays. “Through Spaces, we want to inspire people to imagine where they can go and what they can do in a Rivian.”Additionally, reflective of Rivian’s environmental efforts in manufacturing their vehicles, so too will Spaces be designed with consideration of their footprint and impact. “For example, for our 10th Avenue Space in New York City, we intentionally minimized the structural buildout in favor of modular components that can be moved from site to site,” explains Cherry, “Future Spaces locations like Laguna Beach, CA and Groveland, CA, showcase adaptive reuse, breathing new life and purpose into existing structures.”Rivian is bringing in architectural experts to ensure historically-significant features of the historic South Coast theater were retained while updating the interior to contemporary energy, code, and accessibility standards.Rivian Spaces will eventually roll out across the country in other markets, joining the company’s existing network of over two dozen service centers across the U.S. and Canada. These other new Spaces include a showroom housed within a converted movie theater in downtown Laguna Beach, California (above), and also an indoor-outdoor 10,000-square-foot site in Austin, Texas complete with a green space, rooftop patio with panoramic views of the city. Rivian emphasizes the architecture and interior design of each location will reflect their locale, including distinct furnishings within.Rivian’s 10,000 sq. ft. Austin Space will offer direct access to the Ladybird Lake biking and running trail in the city’s South Congress district and a rooftop patio.Space in Williamsburg, BrooklynRivian Space in Groveland, California – a gateway town to Yosemite National Park – is housed within a former historic gas station converted into a modern cabin design aligned with the brand’s modernist adventure lifestyle.In numerous ways Rivian is steering the EV buyer closer to something akin to customers and the Apple Store, wooing potential customers into uniquely designed retail destinations showcasing product to try without the hovering pressure to buy, emphasizing product-focused experiences and education rather than immediate sales. While nothing is guaranteed, we’re apt to predict the future of buying your next car will become nearly as easy as buying an iPhone one day – albeit a bit more expensive.The first Rivian Space opens today, June 16th, at 60 10th Avenue in New York City’s Meatpacking District, with additional locations TBD. Gregory Han is the Managing Editor of Design Milk. A Los Angeles native with a profound love and curiosity for design, hiking, tide pools, and road trips, a selection of his adventures and musings can be found at gregoryhan.com.You can follow Gregory Han on Twitter, Pinterest, and Instagram. Read all of Gregory Han's posts.Gustave Carlson Design respectfully renovated a prized Eichler house in Palo Alto that honored the history while adapting it for modern times.Japanese technology brand BALMUDA dedicated 6 years of design and development to get drip coffee preparation dialed in.As small as a MINI, as capacious as a Tacoma, and designed by Yves Béhar, the TELO mini electric truck is proof big things can come in small packages.Leica's third in the Q series keeps all the great design cues of the Q2 with the addition of a 3-inch high resolution touchscreen.You’ll always hear it from Design Milk first. Our passion is discovering and highlighting emerging talent, and we’re energized by and for our community of like-minded design lovers — like you!","is the first of several brick-and-mortar retail showrooms designed to connect with new EV buyers. Rivian’s Spaces is the first of several brick-and-mortar retail showrooms designed to connect with new EV buyers. Rivian’s Spaces are designed to be casual and inviting, where anyone who is curious is welcome."
technology,2023-06-15,Gregory Han,Samsung New Bespoke Family Hub Refrigerator Doubles Down on Screen Size,https://design-milk.com/samsung-new-bespoke-family-hub-refrigerator/,"Have you ever considered adding a large screen appliance within the context of the social hub of the home, the kitchen?","The earliest versions of Samsung’s Family Hub refrigerators offered what many considered little more than a tablet inset into a refrigerator door experience. But remember, Samsung is the same company that lead the charge with super-sizing phones, nearly single-handedly creating the market for large screen mobile devices known then as “phablets.” No surprise Samsung is taking a similar committed route within the kitchen, maximizing their smart home dashboard and SmartThings ecosystem to an impressive extreme.The new Samsung Bespoke 4-Door Flex Refrigerator with Family Hub+ is a smart home enabled appliance outfitted with an enormous 32-inch, bezel-less, full-HD screen designed to assist in everyday tasks: following recipes, scheduling/planning, monitoring myriad of smart home controls, or even just catching up on some streaming programming.Samsung’s newest Family Hub+ powered fridge doubles the screen size of their previous model; it’s now nearly as large as one of the refrigerator doors. With support for Google Photos, users won’t have to clutter their fridge with paper and magnets.Like other Samsung Bespoke refrigerators, this new Family Hub+ model will eventually allow customization of color and finishes to match the rest of your kitchen. Bespoke Family Hub+ is available in full depth ($4,999) and counter depth ($5,099) models.Over the span of eight iterations Samsung has committed to making their line of Family Hub technology enhanced smart refrigerators a standard in the evolution of kitchen appliances, integrating ever larger and more capable app-powered displays right into the refrigerator doors.One benefit of this much larger fridge screen is the option to check the contents within without even opening the door. Built-in AI cameras inside allow a peek inside to determine if you should even bother opening the fridge or get working on a new grocery list.If you already bring a tablet or phone into the kitchen to view recipes, text friends/family, or stream content while cooking or eating, the utility of a 32-inch screen is going to be obvious. Daily tasks like meal planning, creating shopping lists, viewing family calendars, and monitoring connected smart home devices are made more easily accessible and legible. Samsung has integrated 190 Samsung TV Plus free channels to watch from the refrigerator screen (albeit with a vertical aspect ratio), with picture-in-picture (PIP) viewing as an option – such is the benefit of a screen nearly as large as a small 4K television nearly stretching the entire expanse of one of the fridge doors.The sleek front of the fridge hides behind one of its doors a hidden interior water dispenser and AutoFill Water Pitcher, complemented by a Dual Auto Ice Maker offering both cubed ice or smaller bite-sized cubes.Of course the benefits of this latest, or any of the Bespoke Family Hub+ powered refrigerators, is magnified if you’re already invested in Samsung’s own SmartThings ecosystem. Samsung hopes to entice users to buy into their whole range of connected devices – from Galaxy phones, to washers and dryers, smart watches, and this fridge. But even sans that degree of brand/app loyalty, the convenience and options proposed by a built-in 32-inch display is undeniably a unique proposition, one that may warrant reconsideration of what a fridge is capable of offering beyond what the appliances have always done.The new Samsung Bespoke 4-Door Flex Refrigerator with Family Hub+ is available now for $4999 for Full Depth and $5099 for Counter Depth.This post contains affiliate links, so if you make a purchase from an affiliate link, we earn a commission. Thanks for supporting Design Milk!Gregory Han is the Managing Editor of Design Milk. A Los Angeles native with a profound love and curiosity for design, hiking, tide pools, and road trips, a selection of his adventures and musings can be found at gregoryhan.com.You can follow Gregory Han on Twitter, Pinterest, and Instagram. Read all of Gregory Han's posts.Gustave Carlson Design respectfully renovated a prized Eichler house in Palo Alto that honored the history while adapting it for modern times.Japanese technology brand BALMUDA dedicated 6 years of design and development to get drip coffee preparation dialed in.As small as a MINI, as capacious as a Tacoma, and designed by Yves Béhar, the TELO mini electric truck is proof big things can come in small packages.Leica's third in the Q series keeps all the great design cues of the Q2 with the addition of a 3-inch high resolution touchscreen.You’ll always hear it from Design Milk first. Our passion is discovering and highlighting emerging talent, and we’re energized by and for our community of like-minded design lovers — like you!","is available in full depth ($4,999) and counter depth ($5,099) models. The new family Hub+ is a smart home enabled appliance outfitted with an enormous 32-inch, bezel-less, full-HD screen. It’s now nearly as large as one of the refrigerator doors; it’s nearly as large as one of the refrigerator doors."
