topic,date,author,headline,link,subline,article,summary
technology,2023-06-15,Gregory Han,Google's Holographic Project Starline Adds a New Dimension to Working From Home,https://design-milk.com/googles-holographic-project-starline-adds-a-new-dimension-to-working-from-home/,Google's desk-sized video chat technology adds a sense of physical dimension and eye contact in nearly life-sized scale.,"Google recognizes many of us are still working remotely and suffering from the same longstanding issues related to working together while not being physically within the same space. In 2021 the company revealed Project Starline as a possible answer to this dilemma, a concept merging hardware and AI-enhanced software to create a “magic window” where users could “talk, gesture and make eye contact naturally with other people in life-size and in three dimensions.” The premise is sort of like a futuristic phone booth and photo booth, with some shades of the holographic communication technology from the Star Wars universe.But that first 3D teleconferencing video booth required a room-sized setup. At this year’s Google’s I/O developer conference Google revealed they’ve been able to shrink Project Starline down to a much more manageable size, one comparable to a large computer display or flat screen television.Like the first iteration, the system uses advanced AI to conjure what is perceived as a photorealistic recreation of the person chatting with you. It does this using a light field display capable of producing perceptible elements of volume and depth that make the person seem “right there.” Instead of looking at a flattened image of a colleague, Project Starline produces a more convincing in-person view retaining the all-important element of eye contact sorely lacking during Zoom, Meet, and other video chat solutions currently available.Google isn’t the only company making efforts to improve video chats; Logitech’s lounge-like Project Ghost video conferencing booth alsom invites a dimensional window-like gaze with other speakers.Google says they’ve already gotten these prototypes into the corporate settings within Salesforce, T-Mobile, and WeWork, but the real test will be when they’re able to further simplify this multi-camera setup for home offices for remote workers, sans the necessity for IT expertise, a future that may supplement or supplant AR/VR glasses.Read all about Project Starline at the Google Blog.Gregory Han is the Managing Editor of Design Milk. A Los Angeles native with a profound love and curiosity for design, hiking, tide pools, and road trips, a selection of his adventures and musings can be found at gregoryhan.com.You can follow Gregory Han on Twitter, Pinterest, and Instagram. Read all of Gregory Han's posts.Gustave Carlson Design respectfully renovated a prized Eichler house in Palo Alto that honored the history while adapting it for modern times.Japanese technology brand BALMUDA dedicated 6 years of design and development to get drip coffee preparation dialed in.As small as a MINI, as capacious as a Tacoma, and designed by Yves Béhar, the TELO mini electric truck is proof big things can come in small packages.Leica's third in the Q series keeps all the great design cues of the Q2 with the addition of a 3-inch high resolution touchscreen.You’ll always hear it from Design Milk first. Our passion is discovering and highlighting emerging talent, and we’re energized by and for our community of like-minded design lovers — like you!",",,,,, and musings can be found at gregoryhan.com. Gregory Han is the Managing Editor of Design Milk. A Los Angeles native with a profound love and curiosity for design, hiking, tide pools, and road trips."
art,2023-06-12,Kelly Beall,Code/Craft/Chaos: The Space Between Man + Machine in Art,https://design-milk.com/code-craft-chaos-the-space-between-man-machine-in-art/,Here design studio posed a big question at London Craft Week 2023: Can technology help us make beautiful art?,"As the space between man and machine continues to grow smaller, design agency Here went to work exploring the rapidly evolving gap between craft and technology. The big question: Can technology help us make beautiful art? The fear is of course that it will lead to lifeless work that lacks both depth and meaning. During London Craft Week, Here shared Code/Craft/Chaos to challenge this viewpoint while transforming digitally generated patterns into crafted pieces of art. In doing so, Here paid homage to Vera Molnar, known as the pioneer of Generative Art. She once famously said, “The machine, thought to be cold and inhuman, can help to realize what is most subjective, unattainable, and profound in a human being.”Here is a B-corp certified company of thinkers, writers, designers, and makers committed to Beautility: making good choices desirable. In Code/Craft/Chaos, digitally generated patterns are turned into crafted artworks using algorithms, making the evolution from pixels to physical, sustainable objects. Handcrafted tapestries, ceramics, screen prints, music, and poetry all received a go at the treatment. Here teamed up with like-minded, environmentally conscious makers and suppliers to turn these experiments into art with their end-of-life in mind. All materials were chosen with care to create the smallest footprint on the planet – from locally printed screen prints to tapestries woven from fashion offcuts.Even working with something as intangible as an algorithm, all artwork materials have been chosen with care to create the smallest impact possible on the planet. “We believe that the advancements within tech are a wonder, an asset, and one of humanity’s finest achievements,” said Connor Davey, Design Lead at Here. “Our latest Craft Week exhibition explores working generatively in this rapidly evolving place where man and machine meet. We’ve embraced the ways in which human subjectivity and soul can transform code-generated art to create pieces that embody our own company’s ‘code’ of value: making things that are both beautiful and useful.”The humble pixel led the way as pattern making was explored with generative techniques. Ben Elwyn, Creative Technologist at Here, shared that “GLSL shaders were coded to traverse and harness the controlled chaos of simplex noise to create a variety of patterns that evolved over time. By taking snapshots of these morphing designs, we created an abundance of imagery to be interpreted, curated, and crafted into other 2D and 3D forms in a diverse range of new and traditional materials.” Six works were included in Code/Craft/Chaos: Carbon Clever Screen Prints, a Code-Woven Quilt, Cyber Ceramics, a Digi Throw, Pixel Poetry, and Codes of Notes.Hand-printed collages born from code, Carbon Clever Screen Prints began with an endless selection of computer-generated patterns. Here turned the random chaos into something more by digitally collaging patterns that were then locally screen-printed onto eco-conscious paper from GF Smith using Living Ink’s Algae Black™ – a carbon negative ink made from algae, not petroleum.Here’s Code-Woven Quilt brings together digitally generated art and the craft of hand-weaving a tapestry. After being turned into a one-of-a-kind tapestry, the quilt was made from waste fabrics donated by responsible cashmere manufacturer Alex Begg. The project also required assistance from UK-based studio, ReWeave, who specialize in woven textile products and explore the possibility of circular fashion on an industrial scale. Yarn was created from the cashmere waste, giving shape to the quilt as code and craft were combined.Digitally generated 3D-printed ceramics have received their fair share of coverage, but the approach to Cyber Ceramics is more nuanced. Beginning with 2D shapes generated by code, Here turned their favorites into 3D bowls and had them printed within a mile of their studio. Because color was introduced to the clay in lumps, each appears at random, making every bowl unique. During the exhibition, the bowls were combined to form totem-like structures – afterward they could be disassembled and go back to their utilitarian purpose. Designed to last, these pieces explore the infinite forms that can be created using a combination of code and craft.To create the Digi Throw, Here worked with Netherlands-based creative textiles platform Byborre to responsibly source sustainable thread. The digitally made blankets layer machine-made patterns into a design of vibrant neon colors that complement the other artworks on display. Digi Throw is made from Byborre’s most sustainable material, a recycled polyester that’s made from post-consumption plastic bottles in Italy before being transformed into fabric without the use of chemicals. The process emitted 29.10% less carbon and saved 31.11 liters of water in making the throws when compared to the creation of traditional fashion textiles. From start to finish nothing goes to waste, because the blankets will only be made once they reach a minimum order quantity.Perhaps a bit more unexpected, poetry can be created in collaboration with a machine – check out Pixel Poetry. Words are their own type of material and can be recycled all the same. In this case, short stories were written by hand for the exhibit before becoming redacted at random by machine. The result is complete chaos, but it’s entirely your own.From words it’s only a natural progression to music. Codes of Notes is an animated triptych that moves in response to melodies generated using machines, but composed and arranged by a human. Collaged computer-generated soundbites created a new composition, while Here curated and arranged them into a harmony. In the end, human musicians played the music on their instruments, adding the elements of heart and soul to the digital masterpiece. Alongside, three generative animations respond to the music as it heightens, bringing with them even more unpredictable, chaotic algorithms.To learn more about Here and the rest of their portfolio, visit heredesign.com.Kelly Beall is senior editor at Design Milk. The Pittsburgh-based graphic designer and writer has had a deep love of art and design for as long as she can remember, and enjoys sharing her finds with others. When undistracted by great art and design, she can be found making a mess in the kitchen, consuming as much information as possible, or on the couch with her three pets. Find her @designcrush on social.You can follow Kelly Beall on Twitter, Facebook, Pinterest, and Instagram. Read all of Kelly Beall's posts.Gustave Carlson Design respectfully renovated a prized Eichler house in Palo Alto that honored the history while adapting it for modern times.Japanese technology brand BALMUDA dedicated 6 years of design and development to get drip coffee preparation dialed in.As small as a MINI, as capacious as a Tacoma, and designed by Yves Béhar, the TELO mini electric truck is proof big things can come in small packages.Leica's third in the Q series keeps all the great design cues of the Q2 with the addition of a 3-inch high resolution touchscreen.You’ll always hear it from Design Milk first. Our passion is discovering and highlighting emerging talent, and we’re energized by and for our community of like-minded design lovers — like you!",", and, and useful. Here teamed up with like-minded, environmentally conscious makers and suppliers to turn digitally generated patterns into crafted pieces of art. The big question: Can technology help us make beautiful art? The fear is of course that it will lead to lifeless work that lacks depth and meaning. Here teamed up with like-minded, environmentally conscious makers and suppliers to turn these experiments into art."
art,2023-06-09,Gregory Han,Dyadic Series Weaves New Explorations of 3D-Printed Forms,https://design-milk.com/dyadic-series-weaves-new-explorations-of-3d-printed-forms/,Brian Peters' new Dyadic Series are limited-edition 3D-printed ceramic sculptures that offer a convincingly woven appearance.,"Pittsburgh-based spatial artist and designer, Brian Peters’ experimentation and exploration within the overlapping realms of architecture, art, and fabrication has culminated in the Dyadic Series, a new collection of limited-edition 3D-printed ceramic sculptures that offer a convincingly woven appearance rather than the hallmarks of typical 3D additive printing.Peters’ multi-disciplinary approach integrates technology as a means to an end, rather than an end itself, an ethos in full display across these ceramic sculptures. “I am not interested in the perfection of machine-made objects,” remarks Peters, “But rather the art of integrating digital coding, custom-built technology, contemporary aesthetics, and natural clay.”Each sculpture of the Dyadic Series is digitally crafted using a customized 3D printer, a machine Peters hacked to produce the convincing textured design. The bespoke 3D printer prints using two different colors of clay in a pattern that gives the appearance of a woven surface similar in weave to outdoor PVC plastic rugs. This two clay process makes the color integral to the piece, as the material is neither glazed nor colored after fabrication. Peters notes the custom 3D printer and coding process required over a year to develop and fine tune, with the Dyadic Series the first final sculptures utilizing these tools.Drawing upon the natural world – flora, the artistry of patterning, and the complex geometries of contemporary forms – the Pennsylvania ceramicist distills beauty from his surroundings, transforming clay into remarkably intricate designs showcasing woven-like patterns and textures that tempt touch.Each sculpture is signed and numbered by Peters.Peters’ full portfolio of work spans a wide scale – from the intimate to site-specific installations such as his elegantly realized Prairie Cord, a 3D-printed ceramic block arch commissioned by the Olbrich Botanical Gardens in Madison, Wisconsin.One of the vessels will be on exhibit at the Hunterdon Art Museum for Clay Bash 2023 through September, a triennial juried exhibition of ceramics. To inquire about availability and pricing, visit brian-peters.com.Gregory Han is the Managing Editor of Design Milk. A Los Angeles native with a profound love and curiosity for design, hiking, tide pools, and road trips, a selection of his adventures and musings can be found at gregoryhan.com.You can follow Gregory Han on Twitter, Pinterest, and Instagram. Read all of Gregory Han's posts.Gustave Carlson Design respectfully renovated a prized Eichler house in Palo Alto that honored the history while adapting it for modern times.Japanese technology brand BALMUDA dedicated 6 years of design and development to get drip coffee preparation dialed in.As small as a MINI, as capacious as a Tacoma, and designed by Yves Béhar, the TELO mini electric truck is proof big things can come in small packages.Leica's third in the Q series keeps all the great design cues of the Q2 with the addition of a 3-inch high resolution touchscreen.You’ll always hear it from Design Milk first. Our passion is discovering and highlighting emerging talent, and we’re energized by and for our community of like-minded design lovers — like you!",",,,,,,sssss integrating digital coding, custom-built technology, contemporary aesthetics, and natural clay., he says, “I am not interested in the perfection of machine-made objects,” he adds.Peters’ full portfolio of work spans a wide scale – from intimate to site-specific installations such as his elegantly realized Prairie Cord."
featured,2023-06-08,Gregory Han,ECOVACS Adds Major Mopping Innovations to Its Newest DEEBOT T20 OMNI,https://design-milk.com/ecovacs-adds-major-mopping-innovations-to-its-newest-deebot-t20-omni/,"The first robot vacuum capable of switching from vacuuming to mopping on-the-go using 131-degree heated water to disinfect + remove stains, the DEEBOT T20 OMNI even blows hot air to leave floors dry to the touch.","The following post is brought to you by ECOVACS. Our partners are hand-picked by the Design Milk team because they represent the best in design.Can we ask you something personal? How often do you clean your floors? If you’re like us, busy and stretched thin, probably not as often as you’d like. Wayward pieces of popcorn, strands of hair, stains from spills past and forgotten, with a community of dust bunnies peeking out from underneath the sofa – they are all remnants and reminders of responsibilities deferred till “tomorrow.” But we understand – cleaning can be a tedious task, especially within homes with a mix of floor surfaces, requiring switching between vacuuming and mopping. Thankfully, autonomous cleaning technologies designed to relieve the burden of everyday chores have continued to improve to the point where there is a strong argument that every home should have a bit of robotic help around the house.This is where the state-of-the-art ECOVACS DEEBOT T20 OMNI presents a very compelling solution: a 4-stage autonomous cleaning system equipped to solve the either/or dilemma of cleaning both hard and soft surfaces. Equipped with a flexible vacuum and mop hybrid system, complete with integrated hot water mop and drying, the DEEBOT T20 OMNI distinguishes itself from other robot vacuum cleaners by offering an unmatched degree of cleaning capabilities without compromise, cleaning and emptying dry or wet debris automatically.The fully sealed style OMNI base station is where dust and allergens are automatically emptied into and also where the unit self-washes with hot water for maintenance-free cleaning for more than 60 days at a time.The promise of a cleaner home done faster – and better – than other robot vacuums is made possible by ECOVACS’s OZMO Turbo 2.0 mopping system, a hot water mop washing technology engineered to automatically detect grime while gliding across hard surfaces, applying a water heated pressure wash at 131°F to easily remove stains and loosen debris. A pair of spinning mop heads rotate 180 times per minute to make floors sparkle before concluding with a blow of hot air, speeding up drying for near instantaneous results.Regardless of your home’s decor and furnishing, the T20 OMNI is ready to confidently negotiate any floor plan using the same LiDAR-based technology that helps self-driving cars navigate city streets.Imagine sending out the DEEBOT T20 OMNI for one last clean sweep on days when you have guests coming over. Or scheduling the vac every morning after you leave for work, ensuring you return to a home that is cleaner than when you left. Instead of worrying about wet footprints or slips and slides, you can trust that your floors will be dry and safe for kids, pets, and everyone else at home.In addition to these standout features, the DEEBOT T20 Omni robotic vacuum excels in everyday vacuuming duties with its intelligent mapping system. An array of sensors allows for efficient and thorough cleaning, effortlessly navigating through normal furnishings and everyday objects within the home, and capable of getting to those hard-to-reach nooks and crannies most robot vacuums skip over.The vacuum’s powerful category-leading 6000Pa suction power suction, aided by a new rubber brush with spiraling blades, ensures that every speck of dirt is grabbed, leaving no trace behind. Most importantly, the DEEBOT T20 Omni’s strength is its adaptability and versatility, equipped with sensors that can automatically detect whether your floors require vacuum-only cleaning, mop-only cleaning, vacuuming while mopping, or vacuuming first before mopping.ECOVACS designed the DEEBOT T20 Omni to be fully compatible with smart home systems, allowing you to control and schedule cleaning sessions with ease using Alexa, Google Assistant, Siri Shortcuts or by calling out, “OK YIKO” with the ECOVACS app.The DEEBOT T20 Omni is a shining example of how the smart home has advanced to a degree where robotic technologies no longer exist as speculative “in the future” promises, but are now genuinely making the most mundane of everyday duties less burdensome, and adapting to how you live instead of requiring you to adapt to the technology you’ve invited into your home. To learn more about the ECOVACS DEEBOT T20 OMNI and all of ECOVACS robot vacuums, visit meetdeebot.com and ecovacs.com.Gregory Han is the Managing Editor of Design Milk. A Los Angeles native with a profound love and curiosity for design, hiking, tide pools, and road trips, a selection of his adventures and musings can be found at gregoryhan.com.You can follow Gregory Han on Twitter, Pinterest, and Instagram. Read all of Gregory Han's posts.Lineup, created by Arcadia + IDA Design, is a diverse collection of innovative commercial products meant to aid in collaboration + bring people together.The first robot vacuum capable of switching from vacuuming to mopping on-the-go using 131-degree heated water to disinfect + remove stains, the DEEBOT T20 OMNI even blows hot air to leave floors dry to the touch.3form's new metallics collection – Flare – adds shimmer to its Varia + Chroma materials for a fresh take on texture + light refraction.MG+BW Home joins forces with Rafael de Cárdenas to create a larger-than-life home furniture collection. From the living room to the dining room to the bedroom, these contemporary classics will make their mark.You’ll always hear it from Design Milk first. Our passion is discovering and highlighting emerging talent, and we’re energized by and for our community of like-minded design lovers — like you!",", a 4-stage autonomous cleaning system equipped with a flexible vacuum and mop hybrid system. Equipped with integrated hot water mop and drying, the DEEBOT T20 OMNI distinguishes itself from other robot vacuum cleaners. ECOVACS offers an unmatched degree of cleaning capabilities without compromise, cleaning and emptying dry or wet debris automatically."
