topic,link,headline,author,date,article,summary,spsummary
CULTURE NEWS,https://www.euronews.com/culture/2023/05/29/flushless-toilets-and-a-popup-shop-the-must-see-pavilions-at-the-2023-venice-architecture-,The must-see pavilions at the 2023 Venice Architecture Biennale,Rebecca Ann Hughes,2023-05-29,"This year’s Architecture Biennale in Venice is wacky, thought-provoking and inspiring. Curator Lesley Lokko, of Scottish-Ghanaian origins, has shone the spotlight on Africa with over half the participants from the continent or its diaspora.Installations and exhibitions tackle topics of climate change, colonialism and indigenous culture.But with so much extraordinary culture on display, a visit to the vast Biennale can be overwhelming. There are 27 pavilions in the Giardini and 22 in the Arsenale as well as 14 dotted through Venice.Here’s our guide to the must-see exhibitions and pavilions at the 18th edition of the international festival.Finland’s contribution to the Biennale begins just outside the Alvar Aalto-designed pavilion with what looks like a Duchamp-esque conceptual sculpture.In a rectangular pit, a broken ceramic toilet bowl is half buried in the earth. This is intended as a staged reconstruction of an archaeological excavation that “symbolically consigns the flushing toilet to history,” according to the Dry Collective group behind the project.Inside the pavilion, the exhibition presents a Finnish sanitation solution for the future. In the centre is a wood panelled structure housing a huussi – a composting toilet used by thousands of Finnish people living in rural settings.“We cannot live on a planet where billions of people use rapidly diminishing fresh water resources to flush their waste,” says curator Arja Renell.“Huussi inspires and invites all professionals to start looking for alternative solutions which would better serve the world we inhabit today.”The light-filled Pavilion of Nordic Countries is an aesthetic jumble of reindeer skin tents, logs carved into seating and wooden huts.At the heart of the installation is artist and architect Joar Nango’s archive of books about Indigenous architecture collected over 15 years.Girjegumpi: The Sámi Architecture Library is a social space which has already travelled to different locations in the Nordic region.It invites visitors to use the pavilion as a reading room to learn about topics including Sámi architecture and design, ancestral building knowledge, activism and decolonisation.Pushing aside a black curtain, visitors to Uzbekistan’s pavilion in the Arsenale find themselves in a dimly lit space confronted with a brick-walled labyrinth.The structure takes inspiration from the traditional building material of ancient fortresses known as qalas in the Karakalpakstan region, although the bricks themselves were reclaimed from the area around Venice.The maze is also intended as a symbol of contemporary architecture having lost its way as buildings continue to be designed without consideration for a warmer future.In a few of the walls, a spotlight shines on brilliant blue ceramic tiles. These enamelled inserts were made by Uzbek artist Abdulvahid Bukhoriy, one of the few remaining craftsmen of the blue Bukhara technique.In Brazil's national pavilion, curators Gabriela de Matos and Paulo Tavares deconstruct the founding myth of Brasília, a capital built in “the middle of nowhere.”As they explain through text and maps, the area was actually home to Indigenous and Quilombola populations who were driven out by colonisers.In a second room, a floor and structures made from earth (the exhibition is titled “Terra [Earth]"") immerse visitors in the fundamental, ancestral materials of Brazil.By far the brightest pavilion, Latvia’s installation is a celebration of its tenth year at the Architecture Biennale with a “supermarket of ideas.”There’s a check out at the front while the rest of the room is divided into aisles stacked with colourful products.Shaped like different supermarket items - detergent, tinned tomatoes, jam - flat cutouts present the pavilion concepts from the last 10 Biennale shows.The curators used AI technology to feed in content about past exhibitions and short descriptions were then printed onto over 500 items to line the supermarket’s shelves.The supermarket has a distinct pop art vibe, recalling the critiques of consumption by artists like Andy Warhol.","is a jumble of reindeer skin tents, logs carved into seating and wooden huts.It invites visitors to use the pavilion as a reading room to learn about topics including Sámi architecture and design.","Installations and exhibitions tackle topics of climate change, colonialism and indigenous culture."
CULTURE NEWS,https://www.euronews.com/culture/2023/05/26/at-the-2023-venice-biennale-empowered-african-creatives-lead-architecture-into-the-future,"At the 2023 Venice Biennale, the future of architecture is Africa",Rebecca Ann Hughes,2023-05-26,"In the past few years, European dominance over culture and display has been disrupted. Nations until now largely left out of the story of art and architecture have been calling for a rewrite, beginning with the restitution of numerous stolen heritage objects.The Venice Biennale is joining this growing drive to redress the balance - one exhibit is actually the design for a structure in Nigeria to house the returned Benin Bronzes.For the first time, the international exhibition has a curator of African origin. Scottish-Ghanaian Lesley Lokko has ensured the continent takes the spotlight; more than half the participants are from Africa or the African diaspora.The Biennale, historically dominated by a euro-centric vision with minor participation from Asia and the Americas, is being led by Africa this year.Lokko’s show makes bold, forward-thinking statements about who will lead the discipline of architecture into the future.Alongside Africa, decarbonisation is another key theme of her exhibition and she shows that the two are inextricably connected.As the world warms, the architecture sector needs to look to the countries already building for the heat.One gallery in the Central Pavilion of the Giardini has been transformed by Nigerian-born Olalekan Jeyifous into a fantastical futuristic imagining of the continent freed from the hangover of colonialism and its economic exploitation of Africa.The installation has transformed a room into a bright, leafy space employing green technologies and Indigenous knowledge systems. It represents the “All-African Protoport,” a transport hub for low-impact, zero-emissions land, sea and air travel.The 2023 Biennale also looks to historic architecture movements and gives space to African creatives to correct their narratives. As Lokko says, “the ‘story’ of architecture is incomplete. Not wrong, but incomplete.”In the Applied Arts Pavilion of the Arsenale, a long corridor (deliberately mimicking the architectural style discussed in the installation) presents a visual and descriptive history of tropical modernism.The movement merged the international modernist style with knowledge of the hot, humid conditions in western Africa.Tropical modernism has long been defined as a colonial style, funded by the British Colonial Office. But, as the V&A who curated the exhibition write, “the style survived the transition to Independence, when it became a key aspect of nation-building and symbol of the progressiveness and internationalism of these new countries.”Their installation, which also includes a 30 minute video, aims to “complicate the history of tropical modernism by engaging with and centring African perspectives.”Niger makes its debut at the 18th edition of the international exhibition. Archifusion, housed on the island of San Servolo, is an emeshing of African and Western cultures giving rise to a cultural “laboratory.”The installation is built around a kind of brick - the brique magique - made with locally-sourced materials in Niger.The shape and structure of the humble construction material has been modified to improve its thermal inertia and stability for buildings of the future.",", of the African continent, of tropical modernism.The installation has transformed a room into a bright, leafy space using green technologies and Indigenous knowledge systems. The installation has transformed a room into a bright, leafy space using green technologies and Indigenous knowledge systems.","The Biennale, historically dominated by a Euro-centric vision with minor participation from Asia and the Americas, is being led by Africa this year. Curator Lesley Lokko’s show makes bold, forward-thinking statements about who and what will drive the future of architecture."
SEE,https://www.euronews.com/culture/2023/05/25/blooming-lovely-highlights-from-chelsea-flower-show,Take a look at highlights of this year's Chelsea Flower Show,Saskia O'Donoghue,2023-05-25,"The creme de la creme of gardening exhibitions opened this week - and Euronews Culture was at the start of Chelsea Flower Show in London to bring you a rundown of all the best things to look out for - whether you’re visiting or admiring the designs from afar.Officially opened by newly crowned King Charles and Queen Camilla, 2023’s event is taking place - as always - at the Royal Hospital in Chelsea and boasts 36 as well as countless stalls featuring the best of plants and garden furniture from across the globe. It’s full to bursting with inspiration for even the least green-fingered garden fans and no matter how small or large your outdoor space, it’s possible to take aspects from the award-winning designs and apply them to your own garden.Common themes at this year’s flower show are muted colours - lots of whites, pale yellows and purples - the ongoing rewilding versus manicured garden debate, sustainability, accessibility and drought tolerant planting to combat rising temperatures.On Tuesday 23 May, awards were handed out at the world’s most prestigious gardening event - here are the top prize winners…Best Show Garden: Horatio's Garden designed by Charlotte Harris and Hugo BuggPaid a visit by Queen Camilla, the garden meets the needs of people with mobility issues and embraces the mission of the Horatio’s Garden charity which aims to create and nurture beautiful, accessible gardens in NHS spinal injuries centres.Best Construction Award (Show Garden): The Centrepoint Garden designed by Cleve WestThis striking garden, featuring a ruined house, weeds and a tree torn from its roots, aims to serve as a metaphor for what it means to be young and homeless. The Centrepoint charity helps those young people without a home and the garden incorporates around 120,000 dots, highlighting the number of homeless youths in the UK.Best Sanctuary Garden: The National Brain Appeal's Rare Space designed by Charlie Hawkes / Best Construction Award (Sanctuary Garden)This space, which won two awards, was designed to be enjoyed by people living with dementia, featuring bright visuals and calming surroundings, including a textured path, brightly coloured seating, soothing water features and sheltered spaces for those afflicted.Best Balcony & Container Garden: Feels Like Home designed by Rosemary ColdstreamThis small garden was inspired by Coldstream’s childhood in New Zealand and features sculptural plants, rich colours and natural materials which come together to make the space 'feel like home' for the designer. It also touches on the theme of the increasing necessity for drought resistant plants for a changing climate across the globe.Best All About Plants Garden: The Talitha Arts Garden designed by Joe and Laura CareyThis design celebrates the creative arts and their therapeutic power to help those who’ve suffered trauma. It uses a minimalist palette focusing on the contrast between darkness and light and uses sculpture and muted colours as a metaphor for trauma recovery.Other highlights from Chelsea Flower ShowIn a Chelsea first, designer Manoj Malde married his partner of 33 years, Clive Gillmor, in his own garden at the show.It’s the only wedding ever held at the Flower Show in its 110 year history and was particularly significant for this year’s theme of diversity and inclusion and was celebrated by the RHS. Judge Alexander-Sinclair said, told the PA news agency: “It’s a Chelsea first and Chelsea one-off – it’s not something you expect to happen at a flower show”, adding, “Isn’t it a glorious idea? Somebody who actually designs this garden about bringing people together, then gets married [in] it. It’s a nice way to connect the whole thing”.Very few animals are allowed at Chelsea due to safety concerns - in fact, bees were removed from The Newt’s garden in case of stings - so one four-legged visitor was the toast of the show.Daisy, a dog rescued from a puppy farm, enchanted visitors as the official mascot of the RSPCA’s garden. As well as raising awareness of the charity, the designers explained they’re aiming to inspire gardeners, calling them, “the secret weapon against wildlife decline”.Celebrities are a mainstay of the opening of Chelsea Flower Show and this year's star-studded guest list didn't disappoint.As well as a visit from the King and Queen, Princess Kate joined Chelsea pensioners - ex-military members who live on the grounds of the Royal Hospital - as well as picnicking with school children.Oscar-winning veteran actress Judi Dench was in attendance as well as 'Succession star' Matthew Macfayden and his wife Keeley Hawes.Stars of the silver screen, including Jim Broadbent, 'Downton Abbey' actor Jim Carter and 'Absolutely Fabulous' Patsy - AKA Joanna Lumley - enjoyed the gardens on display.Not to be mistaken for the King himself, actor Dominic West - who portrayed Charles in 'The Crown' posed for photos at the Flower Show. Euronews Culture spoke to many attendees and the consensus was, although the favourite gardens mentioned didn’t win any top awards, the stand outs were…RHS Garden of Royal Reflection and Celebration designed by Dave GreenThis small garden, commissioned by the RHS and therefore not eligible for judging, used plants favoured by the royal family, specifically King Charles III and the late Queen Elizabeth II, as well as elements used at royal residences. Designed to celebrate the Coronation of King Charles, it features a bronze sculpture of the new monarch.A Letter from a Million Years Past designed by Jihae HwangThis impressive garden features a large herb drying structure, usually found in the eastern part of Jirisan - known as 'the mother mountain of South Korea'. The design uses rocks weighing more than 200 tonnes which form a recreation of that mountain, as well as trees, plants and herbs selected for their healing and medicinal properties.The Biophilic Garden Otsu - Hanare designed by Kazuyuki IshiharaA ‘must see’ for Chelsea visitors, this garden focuses on the Japanese 'hanare', is a small house separated from the main building, considered to be a place of healing. Using moss and water features, this design is one of the most peaceful at the entire event.While all awards given by RHS judges have been handed out, the People's Choice winner is set to be announced on Friday, 26 May.",",,,,,, a creme de la creme of gardening exhibitions opened this week - and Euronews Culture was at the start of Chelsea Flower Show in London to bring you a rundown of all the best things to look out for - whether you’re visiting or admiring the designs from afar. Horatio’s Garden: Horatio's Garden designed by Charlotte Harris and Hugo BuggPaid a visit by Queen Camilla.",The most prestigious gardening show in the world is back in London - and Euronews Culture was there to see the event in all its glory
CULTURE NEWS,https://www.euronews.com/culture/2023/05/25/a-visible-vacancy-why-venice-blocked-austrias-biennale-pavilion-proposal,Why Venice blocked Austria’s Biennale pavilion proposal,Rebecca Ann Hughes,2023-05-25,"Austria's pavilion at the 2023 Venice Architecture Biennale opened to the public last weekend as an incomplete project.The proposed installation, titled Partecipazione / Beteiligung, was given a hard no from Venice authorities.Ironically, this rejection actually proves the point that the Austrian pavilion’s curators were trying to make.So why was the pavilion so controversial?The Austrian pavilion is situated in the Giardini at the northeastern border wall that separates the Biennale from the city. Over the wall is the area of Sant'Elena, a mainly residential zone of Venice.Architecture collective AKT and Viennese architect Hermann Czech proposed building a bridge as part of the installation that would link the city neighbourhood to half of the pavilion.The idea was to give residents of Venice free access to the space (although not to the Biennale as a whole). This area was to be “assigned” to the population of Sant’Elena as a place for urban initiatives and social exchange.The idea of the Austrian pavilion was motivated by mounting criticism from local community and activist groups that the international exhibition does not benefit the city’s population.The project would have quite literally given space back to the surrounding city, a reversal of the expansion over the last decades of the Biennale zone.In the first room of the pavilion, a display of imagery and descriptions details how the international exhibition has expanded and usurped space in a city where land is limited.Local initiatives have criticised the exclusive use of space and called for the Giardini and the Arsenale to be opened up to residents all year round.“[This] would, as well as benefiting Venice’s citizens, make the link between the Biennale and Venice stronger and more dynamic,” reads a quote from the authors of newspaper Il Giornale dell'Arte displayed in the installation.“We are profoundly committed to preventing the parts of the Arsenale not occupied from being transformed into a shell for trade fair activities and the Biennale exhibitions, which can only be accessed by paying an entrance fee,” reads another comment from Forum Futuro Arsenale.Upon presenting their project to the Biennale and city authorities, the curators of the Austrian Pavilion found their ideas refused.Minutes from a meeting, posted up in the installation, report that the project could not be approved because the “administration cannot create the precedence of an entrance that is not part of the Biennale’s area for security reasons.”As such, in the courtyard of the pavilion there is a half constructed metal bridge. You can climb up the steps to look over the wall into the Sant’Elena neighbourhood.The incomplete bridge and empty courtyard now speak volumes about the role of the Biennale in the local community.“Instead of a bustling laboratory, the pavilion’s half originally intended for public use will become a visible vacancy, a permanent construction site underscoring the central question of the project,” say the curators.","is a reversal of the expansion over the last decades of the Biennale zone.Ironically, this rejection actually proves the point that the Austrian pavilion’s curators were trying to make.the pavilion at the 2023 Venice Architecture Biennale opened to the public last weekend as an incomplete project.","The proposed installation, titled Partecipazione / Beteiligung, was given a hard no from Venice authorities."
TOUCH,https://www.euronews.com/culture/2023/05/18/designers-and-their-homes-alexander-lerviks-swedish-kit-house-renovation,Look inside Alexander Lervik's renovated kit house south of Stockholm,Saskia O'Donoghue,2023-05-18,"High-profile Scandinavian designer Alexander Lervik wasn’t sure that he’d adjust to life outside of Stockholm after being a city dweller for years but, since moving to his redesigned house with Elin, his communications strategist wife and their children, he hasn’t looked back.Their home in the archipelago of in Saltsjöbaden, just south of the Swedish capital, needed total renovation and the Lerviks undertook the project with aplomb. Originally a kit house from 1961 - it’s said that over 80% of single-family homes in Sweden have been ordered from a catalogue - the design-focused pair made sure to improve their home with a focus on sustainable materials, timeless design and longevity.Alexander Lervik told Euronews Culture that the restoration was no mean feat: “The building process itself took 9 months so with planning almost 1.5 years. We moved in before construction was completely finished because we got rid of our other accommodation, but it was basically finished indoors so it was okay.”The family moved into the three-storey property in the autumn of 2021 and drew on Alexander’s long career as a furniture and lighting designer for leading Scandinavian producers and international companies such as Italy’s Moroso.Sustainability was at the forefront of Alexander’s plans when he planned the renovation of the house, with the designer explaining, “we have made sustainable choices so that the house can stand over generations. It has cost more but has a completely different quality in, for example, solid oak floors that can be sanded 10-15 times.” He added, “We have reused brick in the parts where we opened up windows and used that brick for the new extension. We also got hold of old roof tiles of the same type as the existing roof so that we could replace broken ones instead of buying a whole new roof.”The home’s largened windows are a particular favourite of Alexander’s and, he says, the family start every morning with an impressive view of a forest outside of the house, which was partially hidden before the restoration.Alexander is also particularly proud of the house’s elevator, the Aritco HomeLift, which he originally designed in 2016. He tells Euronews Culture that every new visitor on arriving at the home, “immediately wants to try [it] out”.Before moving in to the house, the Lerviks bought a lot of furniture and art at various auction houses and pieces by contemporary designers Philippe Starck, Monica Förster, Achille Castiglioni among others, mixing them in with pieces of his own design and sculptures made by his parents. Despite being spoiled for choice, he says his favourite part of the house is the impressive picture wall in the home’s airy kitchen.While the garden is mostly Elin’s domain - Alexander explains, “my wife is most passionate about the garden and sows seeds herself in early spring so that in summer it is completely overflowing with beautiful flowers” - it’s still a work-in-progress for the couple. The outdoor space, also home to the family’s pet rabbits, is currently undergoing a makeover which will add a terrace of flower beds to the existing garden.Despite the few tweaks still to be made, Alexander says his property is a very happy place for him, saying, “I've never felt as at home as I do in this house - a lot of that is because we tore down the entire interior of the house and created a completely new floor plan with new window sections and completely new positions on the walls, bathroom and kitchen. It is completely made according to how my wife and I think a home should function and feel”.In terms of advice for people inspired by the Lerviks' style, Alexander says it’s best to throw caution to the wind: “Dare to go outside the box and add items to your home that you wouldn't normally choose… [go for] something that teases your mind [as that] can do wonders for the overall feel of a home”.To learn more about Alexander Lervik’s custom home elevator, visit www.aritco.com/",",,,,,,, was originally a kit house from 1961 - it’s said that over 80% of single-family homes in Sweden have been ordered from a catalogue.Alexander Lervik says the restoration was no mean feat: “we have made sustainable choices so that the house can stand over generations”.Alexander is particularly proud of the house’s elevator, the Aritco HomeLift, which he originally designed in 2016.","As part of our series on designers' homes, Euronews Culture takes a look inside Alexander Lervik's property just south of Stockholm."
