topic,link,headline,author,date,article,summary,spsummary
TOUCH,https://www.euronews.com/culture/2023/04/22/fornasetti-goes-more-compact-but-still-as-quirky-at-milan-design-week,How a ceramics brand is keeping things traditional 80 years on,Saskia O'Donoghue,2023-04-22,"If you’re in Milan for Design Week, don’t miss a visit to Fornasetti’s exhibition. The iconic Italian brand founded in the 1940s, famous for its ceramics with opera singer Lina Cavalieri's face, is unveiling its new collection. ‘The Syntax of Making' is Fornasetti's three new collections of furniture and accessories for the home characterised by new decorations that speak for the brand’s quirky design look.The new collections all dip into themes from the brand's archive. Giro di Conchiglie features three-dimensional sea-themed images including, of course, shells and a blue-coloured background with a hand-painted water-streaking effect.Giardino Settecentesco stands out for its use of vibrant colour and is inspired by natural landscapes and neoclassical style buildings while the Musciarabia con Rose collection plays into the brand’s famous geometry and black lines, adding hand-painted pink flowers which pop on the monochromatic backgrounds.Across the three collections are various pieces of furniture and accessories for the home, including wooden cabinets, bedside tables, trays, mirrors, lamps and, of course, porcelain.Fornasetti tells Euronews Culture that their work is so distinctive that owners only need to have a few pieces in order to, “transform any corner of the home into a microcosm of personality and elegance”.The Italian design house is also offering more compact and functional pieces this Salone, including smaller cabinets and bedside tables and console tables which have sharper lines and drawers for adding storage without, Fornasetti says, “sacrificing their elegance”.While a number of the pieces from this collection are perhaps a little more traditional than usual, Fornasetti hasn’t shied away from its famed quirky style, with mirrors in an unusual curved shape - with some featuring a unique design with nine glass bubbles in a mirror - and trays which look like artists’ canvases.Fornasetti explains that it’s crucial for them as a design house to maintain their slow production process to add to the quality of each piece and to pay homage to their Italian heritage, referencing the themes in the Syntax of Making.Barnaba Fornasetti, the brand's artistic director, told press why it’s so important to maintain the same processes they've relied upon for 80 years, saying, ""The value of making things by hand has acquired a deep meaning for me over time. It goes beyond technique and the desire to preserve a firm and coherent identity. It is a choice and a way of being today, in our modern world, an ethical line that puts people and what they make at the centre of everything,” adding, “Craftsmanship is a conscious way of working, fuelled by a dynamic creativity, which embodies the extraordinary capacity to continuously combine abstract knowledge and experience, what I like to call 'thinking with the hands'”.Fornasetti told us that they employ six painters for their furniture and 16 for their small ceramic pieces. It's a local affair, as well as a small one with the workshop based in Milan itself.To demonstrate how much care the brand take with their pieces, visitors to the installation won’t just be able to see the new collection, but also the process behind it, with live painting by the atelier's painters in the store and rooms filled with images from their archive, like silk-screen printing frames used to create their signature black lines.Fornasetti’s offering for the Salone is on display at their store on Corso Venezia in Milan until 23 April.","the brand founded in the 1940s, famous for its ceramics with opera singer Lina Cavalieri's face. Fornasetti is unveiling its new collection of furniture and accessories for the home. Giro di Conchiglie features three-dimensional sea-themed images including shells and a blue-coloured background.","Italian design house Fornasetti, famed for its whimsical, eye-catching designs are using Milan Design Week to launch three collections which include smaller pieces and new themes."
TOUCH,https://www.euronews.com/culture/2023/04/21/exploring-armanis-first-outdoor-furniture-collection-and-other-treasures,A rare glimpse inside Armani's HQ for its new furniture collection,Saskia O'Donoghue,2023-04-21,"If you’re a fan of Armani, you’re in for a treat this Salone del Mobile. For the 2023 event, the Italian design house is opening its doors to present its first ever outdoor collection for Armani/Casa furniture and furnishings.The headquarters of the Giorgio Armani brand is usually closed to the public, but they’re welcoming guests inside for Milan Design Week at the stunning Palazzo Orsini to celebrate the launch.The new pieces are on display in both the Palazzo’s gardens and fresco rooms that are usually reserved for Haute Couture clients.In a garden to the back of the 17th century building, various pieces from the first Armani/Casa collection entirely dedicated to outdoor use are on show - including sun loungers, sofas, tables and ornaments with cactus and lotus flower theming.Displayed with the sound of trickling water from a fountain under spring green trees, much of the furniture appears to be weaved - in typical Armani style - and the accompanying fabrics and upholstery are in hues familiar to connoisseurs of the brand or printed in their signature palm motifs. It’s all built for outdoor use and appears sturdy as well as stylish.Continuing on the tour of the Palazzo, guests can access rooms on the first floor, with more outdoor furniture - which works for indoor spaces - to see.There are pieces strictly for inside use too, including a number that an Armani/Casa representative told Euronews Culture have been crafted with the same artisanal workmanship as an Armani Haute Couture creation.The mother-of-pearl chair, dressing table and desk are particularly impressive, all hand-crafted in Italy and using tiles in a mosaic pattern, playing into the familiar Armani woven look.There are, unsurprisingly, strong Italian influences throughout, especially in the Murano glass branded vases and ceramic trinkets, inspired by the vegetation found throughout the Mediterranean landscape.A personal favourite were the Tarot cards - a somewhat unusual find, but one which plays into Armani/Casa’s playful aesthetic. They are, of course, branded too.A word of warning - this rare opportunity to visit the Palazzo Orsini is unsurprisingly extremely popular and queues can be long. It is absolutely worth the wait but, if you have too much on your plate this design week to add in a visit, here’s the good news - much of the new collection is on display in the Armani/Casa shop windows on Corso Venezia in the city as well.Palazzo Orsini is on Via Borgonuovo in Milan and the Armani/Casa installation is open from 18 - 23 April.",",,,,,,, is opening its doors to present its first ever outdoor collection for Armani/Casa furniture and furnishings. The Italian design house is opening its doors to present its first ever outdoor collection for Armani/Casa furniture and furnishings.The new pieces are on display in both the Palazzo’s gardens and fresco rooms that are usually reserved for Haute Couture clients.A word of warning - this rare opportunity to visit the Palazzo Orsini","The impressive Palazzo Orsini, Armani's headquarters in Milan, place host to the first ever Armani/Casa outdoor furniture collection as well as other new trinkets a part of the Salone."
TOUCH,https://www.euronews.com/culture/2023/04/20/revolutionising-a-classic-dior-and-starck-update-an-iconic-chair-at-milan-design-week,Revolutionising a classic - Dior and Starck update an iconic chair,,2023-04-20,"The Salone del Mobile in Milan, otherwise known as Milan Design Week, is always filled to the brim with heavy hitters from the design world. 2023 is no exception, boasting none other than the launch of a continued collaboration between Dior Maison and Philippe Starck.After starting their relationship last year, the two world renowned French designers have been working on reinventing Dior's iconic Medallion chair, said to be a tribute to the fashion house's late founder, Christian Dior.Among numerous designs, including a boucle fabric and various pieces in Dior’s signature toile de Jouy, is the standout piece - the Monsieur Dior armchair, based on the elegant, oval-backed Medallion chair, a piece associated with the fashion house since 1947.Starck, who has designed a vast catalogue of pieces throughout his career, from buildings and interiors and household objects to boats and watches, explains that the creation of the Monsieur Dior armchair was the logical step in the partnership.“After [the chair] Miss Dior it was natural to expand the family”, he told press at Milan Design Week, “The duo of creations, the Miss Dior Sweet chair and the Monsieur Dior armchair, are perfectly balanced through these essential, existential notions of gravity and lightness, of yin and yang. Miss Dior and Monsieur Dior, Catherine and Christian Dior, the sister and the brother, the chair and the armchair, is the story of a sublime complementary duality"".The Starck-designed chairs are accompanied at the impressive display at the 18th Century Palazzo Citterio in the centre of Milan - as part of Fuorisalone, the satellite show of the main Salone fair based across the city - with matching and complementary tables and stools.The designer has used aluminium throughout his designs and the manufacturing process, speaking of his fondness for its simplicity and durability, explaining, “aluminium is the point zero from which everything is built, the idea of intelligence and purity of technology. The object as it is in its origin, its essence, without any dross”.While aluminium might be simplicity to its core, the display at Palazzo Citterio is anything but. Guests are made to wait in the building’s stunning courtyard before being ushered - literally, there are men wearing branded Dior t-shirts acting as cinema-style ushers shining torches at the floor - into an auditorium. There, visitors are shown a video and musical installation in the round, with toile de Jouy and apparent liquid aluminium on display, surrounded by plain versions of the Medallion chair which move up and down on strings. A post shared by Dior Official (@dior)The experience, created by Soundwalk Collective, is a fairly trippy one although brief and is followed by a quick visit to see Starck’s collection in person before Dior personnel rush you out into the daylight to sit at tables flanked by toile de Jouy printed umbrellas.If you’re keen to get your hands on pieces from the collection, it will be rather a long wait - it isn’t available until next year, when it will go on sale at a selection of Dior boutiques.In Euronews Culture's experience, this is an extremely popular event at Milan Design week so booking ahead is advised to avoid long queues. The Dior by Starck exhibit will be on show until April 23 in Palazzo Citterio at Via Brera 12 in Milan.",",, is a tribute to Dior's late founder, Christian Dior.,, is the story of a sublime complementary duality"".The Salone del Mobile in Milan, otherwise known as Milan Design Week, is always filled to the brim with heavy hitters from the design world.",French designer Phillipe Starck and Dior Maison launch new pieces from their continued collaboration at Milan Design Week
TOUCH,https://www.euronews.com/culture/2023/04/20/a-japanese-italian-fusion-reveal-at-milan-design-week,A Japanese-Italian fusion reveal at Milan Design Week,Saskia O'Donoghue,2023-04-20,"Two of 2023’s Milan Design Week main themes are the use of sustainable design and innovative materials in furniture and homewares.One of the best examples of those themes is the BRACE collection, a collaboration between Milan-based Takeda Katsuya Design studio, and woodworking masters Tatehiko, based in the Japanese city of Ashikaga.Building on past shared projects, the BRACE collection is a new line of easy-to assemble furniture pieces, consisting of a side table, a low table and a shelf, all characterised by the company’s signature diagonal lines, adding to both the strength and aesthetic appeal. Each item is topped with a light, removable tray and can allow for different configurations and applications, adding to its versatility.Euronews Culture met Takeda Katsuya at his design house as part of Fuorisalone, the satellite show of the main Salone fair spread across Milan. The BRACE collection, designed by Katsuya's team and manufactured by Takehito, is also a display of cultural fusion between Italian and Japanese design and is very much a family - and friends - affair.Katsuya and his wife, the artist and painter Iida Takako, met while studying in Florence and she lives between Milan and Ashikaga, keeping in constant contact with her husband on behalf of the Takehito design house and factory in Japan. The couple are great friends with the creative minds behind Tatehiko, which has been in existence since 1892 in the Tochigi Prefecture north of Tokyo.Katsuya explains that the factory - which employs just 20 craftspeople - makes use of traditional techniques, passed down over the generations since the company’s founding. Each piece is handmade and the philosophy behind the company is that nothing is wasted; Katsuya tells Euronews the factory prides themselves on ""using finite resources with utmost care"". As a result, the pieces in the BRACE collection are all small offcuts from larger furniture designs which use Hinoki wood from the Tochigi forest.The wood has been used in the construction and furniture industries in Japan for centuries and is famous, despite its light weight, for its resistance, flexibility and deceptive strength. It’s considered a very precious material as Hinoki can only be grown in very specific environmental atmospheres, like the Tochigi forest, which has low winter temperatures, little snowfall and rich soils which are nurtured by moderate temperatures and rainfall. The forest offers an ideal environment for Hinoki cypress growth and makes wood from there especially prized.The Tochigi forest also inspires the joints used to hold the BRACE collection together. Inspired by the shoots that grow from the ground, they’re made using a traditional Japanese architectural technique called Shiguchi which uses steel to provide strength despite the slim structures.Katsuya explains that their slimness means they can be shipped worldwide in small packages, lessening emissions and working towards a climate friendly industry.While the pieces in the collection are very much Japanese at their core, their simplicity and neutral colours mean they fit in well with bolder Italian design.The Takeda Katsuya Design studio also plays host this Salone to more Japanese-Italian fusion pieces, including those made by master shoemaker Fukaya Hidetaka, who uses offcuts of Italian leather from his larger creations to make furniture like chaise longues and flower vases.The BRACE collection can be viewed at the Takeda Katsuya Design studio at Via del Torchio from 18 - 23 April.","is a collaboration between Takeda Katsuya Design studio and woodworking masters Tatehiko. The BRACE collection is a collaboration between takehito and takehito, based in the city of Ashikaga. BRACE is a new line of easy-to-assemble furniture pieces, consisting of a side table, a low table and a shelf. the pieces are all small offcuts from larger furniture designs which use Hinoki wood from the Tochigi","Designed by Takeda Katsuya's team in Milan and manufactured by Takehito in Japan, the BRACE collection uses wood from the Tochigi forest north of Tokyo in a sustainable and interesting way"
TOUCH,https://www.euronews.com/culture/2023/04/19/milan-design-week-a-visit-to-the-quirky-seletti-and-its-new-surreal-lamps,The most surreal lamps you've ever seen - at Milan Design Week,Saskia O'Donoghue,2023-04-19,"Ciao da Milano! Euronews Culture is at the Milan Furniture Fair - or Salone Internazionale del Mobile di Milano - all week, for its 61st edition.The Design Week, also referred to as Salone, is the largest fair of its kind in the world, showcasing the latest and best in furniture, homeware and design from across the globe. Taking place at the enormous Fiera Milano event space, over 2,500 companies are displaying their products.Running from 18 to 23 April, and attracting hundreds of thousands of visitors, we’ll be bringing you all the highlights from this huge event with a focus on new trends in design, stand out pieces and talents to look out for.First of all, let's showcase one of the most impressive designer of the fair... Seletti. The Italian brand may be almost 60 years old - founded in 1964 - but it’s still profoundly modern. As part of Design Week, the brand, known globally for its surrealist designs like its iconic lipstick mirrors, has created an immersive experience for visitors at its flagship store on Corso Garibaldi in the city centre of Milan.It’s certainly a spectacle - a giant pair of legs heralds your entrance, complete with Seletti-branded plaster and a huge cat with a heart shaped bottom which doubles as an impressive lamp and charger.Walking through the building, you’ll see many of Seletti’s iconic collaborations, including the famous TOILETPAPER designs, which include the lipstick mirror, Classics on Acid by Diesel Living and Antonia Arico’s Magna Graecia collection, a take on ancient Roman and Greek ceramics with a modern twist.However, it’s the courtyard garden to the back of the space which is the real star of this particular show. Dotted around are multiple monster-covered boxes designed by artist Gianpiero D’Alessandro, who has collaborated with Justin Bieber and Snoop Dogg among others. Inside these boxes are the new launches for Seletti from a number of established and up-and-coming homeware designers.Long-time Seletti collaborator Marcantonio has a stand out piece on display inside the boxes - his Window Lamps. The archetypal windows, complete with white frame and clouds floating in a blue sky and surrounded by sparrow lights, have been formed into a bold chandelier.Also inside a box is La Palma, a new lamp design by Dutch duo Kranen/Gille. Jos Kranen told Euronews that the lamp was ""a lockdown project"" used to pass the time during the COVID-19 pandemic. The impressive light, shaped like a full-size palm tree, has never been seen before and, while it's currently for indoor use only, Kranen says they're planning to make it work for outdoors too with adjustments to the metal fabric and wiring. That's one way to shake up an urban garden look. Dutch designer Tomas Schats is also featured at the Seletti showcase, with his On-Off lamps on display. He's an artist who puts illustrations into 3D, with an aim to ""mislead the viewer in a subtle manner"", as is the case with these house-shaped lights. To add to the quirkiness, the chimneys of the houses act as on/off switches to make a functional and whimsical design.Perfectly timed to coincide with the release of this Tetris film, also on show at Seletti is the Tetris Mirror, a mirror designed by Giampiero Romano. Displayed on a background of the popular computer game, the mirror appears to be broken but actually fits together perfectly, offering an unusual take on the looking glass.One of the most engaging set-ups at the Seletti showroom is the circus, featuring lamps by Uto Balmoral, who keeps his real identity a secret. Each piece consists of an asymmetrical striped circus tent lampshade with a circus-themed figures, like a strongman and a burlesque dancer, at the base. Seletti says more lamp base figures will become available as their collaboration continues.Perhaps best known as a tattoo artist, Milanese local Simone Falcetta's approach to his collaboration with Seletti was bound to be a quirky one. With his Diver Lamps, the designer has created two varieties of traditional tattoo art with the vintage diver image, but made them into a 3D piece which is as remarkable as it is practical. They'll go on sale - along with all the other pieces mentioned here - via Seletti in the autumn.The showroom on Corso Garibaldi is open to visitors to Milan Design Week until Sunday, 23 April.","is the biggest fashion fair in the world, showcasing the latest and best in furniture, homeware and design. Taking place at the enormous Fiera Milano event space, over 2,500 companies are exhibiting their products.","As part of Euronews Culture's coverage of Milan Design Week, join us as we take a peek at the Italian design house Seletti's ultra-quirky showcase."
SEE,https://www.euronews.com/culture/2023/04/19/culture-re-view-the-new-reichstag-and-the-architect-behind-our-modern-cities,Culture Re-View: A look back at this day in history,Jonny Walfisz,2023-04-19,"19 April 1999: How Norman Foster changed Berlin’s parliament buildingThe fall of the Berlin Wall in 1989 is one of the most striking moments in 20th century history. As Germans from either side of Berlin tore down the physical and figurative barrier erected by decades of the Cold War, it ushered in a new promised era for Europe.The reunification of East and West Germany was celebrated in a ceremony at the Reichstag, the parliamentary building in Berlin. The building had been the home of previous German governments, including the imperial era and the Nazi regime.Severe fighting during the Second World War put the building in ruins. It was restored in the 70s but couldn’t be used for either German governments as it was outside of the two countries’ borders.In 1991, after the two sides of Germany were reunified, it was decided Berlin would remain the nation’s capital with the Bundestag using the Reichstag as its primary building. To celebrate, reconstruction was in order, and that task was given to the iconic British architect Norman Foster in 1994.Known for his grand glass-based modern innovations, Foster’s architectural firm had designed the eye-catching HSBC Main Building in Hong Kong, alongside many other significant buildings. For the Reichstag, the interior was renovated to bring it up-to-date with the demands of government functions going into the 21st century.Most notable though was Foster’s addition of a glass dome to the top of the Reichstag. Echoing the original design of the building before the damage of the Second World War, the cupola was the suggestion of Gottfried Böhm and voted in by the Bundestag, against Foster’s original and more expensive idea of creating a parasol-like building.Providing a 360° view of Berlin, the glass dome symbolises the reunification as well as the shedding of past national traumas. Thanks to the redesign, the Reichstag is one of the most popular landmarks in Germany, as the second most visited attraction in the country.It opened on this day in 1999.Other Norman Foster city designsBeyond recreating Berlin’s Reichstag, Foster has had a powerful effect on many skylines across the world. His reputation from buildings like the Reichstag has put him first in line for many similar projects aimed at rejuvenating traditional settings.LondonIn Foster’s homeland, the capital’s skyline owes a lot to the architect. Opening just over three years after the new Reichstag building was Foster’s City Hall. Featuring some cross-over design features of the Reichstag, the new building was designed to hold the Greater London Authority.Walking distance from City Hall’s southbank location is also Foster’s Millennium Bridge. The newest addition to the bridges over London’s Thames River, it gained the unfortunate nickname “The Wobbly Bridge” after initial faults caused it to sway when people walked over it.Other major additions include multiple buildings in Canary Wharf and the redesign of Wembley Stadium, the UK’s largest stadium.AstanaFoster’s work has travelled far and wide. From Singapore to California, it’s hard to find a major city that doesn’t have at least one design from the legendary architect. But few cities have felt the Foster fingerprint more notably than the capital of Kazakhstan.When Astana was named Kazakhstan’s capital in 1997, urban planners were brought in to design a city worthy of the capital title. The entire city was redeveloped and Foster’s designs are an integral part of its modern look.The country’s congress hall, the Palace of Peace and Reconciliation was Foster’s first commission. He designed an imposing futuristic pyramid building that can be lit up depending on the occasion.Taking influence from the country’s nomadic roots, Foster also designed the Khan Shatyr Entertainment Center. A neo-futurist building, its fabric roof makes it the largest tent in the world.",", the Reichstag is one of the most visited attractions in the country. Norman Foster changed Berlin’s parliament building in 1989. Foster’s glass-based modern innovations have influenced many skylines across the world.","On this day, the newly designed Reichstag was opened in Berlin in 1999. Behind it was the architect who's designed the look of multiple modern cities."
